{"authority":{"build":false,"catalog_mutation":false,"deployment":false,"evidence_promotion":false,"game_launch":false,"process_execution":false,"publication":false,"runtime_execution":false,"runtime_mutation":false,"save_access":false,"signing":false},"generator":{"generation_input_sha256":"sha256:cccccccccccccccccccccccccccccccccccccccccccccccccccccccccccccccc","id":"bepinex-il2cpp-interop","version":"6.0.0-be.735"},"interop_manifest_sha256":"sha256:6340cf0c84a383562d23c8e04cb66521002853d5dc58e1df8c02f236b0c8c9c0","manifest_kind":"foa-il2cpp-generated-interop","materials":[{"bytes":1048576,"redistributable":false,"relative_path":"BepInEx/interop/Assembly-CSharp.dll","role":"assembly-csharp","sha256":"sha256:dddddddddddddddddddddddddddddddddddddddddddddddddddddddddddddddd"},{"bytes":524288,"redistributable":false,"relative_path":"BepInEx/interop/TG.Main.dll","role":"tg-main","sha256":"sha256:eeeeeeeeeeeeeeeeeeeeeeeeeeeeeeeeeeeeeeeeeeeeeeeeeeeeeeeeeeeeeeee"}],"profile":{"bepinex_version":"6.0.0-be.735","branch":"il2cpp","evidence_state":"PackageInstallValidated","framework_version":"0.1.36","game_version":"1.23.401","profile_id":"foa-1.23.401-il2cpp-bepinex6-tf-0.1.36","runtime_target":"IL2CPP","unity_version":"6000.0.64f1"},"schema_version":1}
